symptoms,body_part,clinic_department,description,medicine_name
淋巴结肿大|发热|斑疹|丘疹|关节疼痛|其他症状,全身,风湿科,"    成人still病是一组病因不明的弛张热,一过性多形性皮疹，关节炎或关节痛为主要临床表现，伴有肝,脾及淋巴结肿大，周围血白细胞增高的一种临床综合征，称为成人Still病,既往命名为亚败血症、变应性亚败血症。本病多见于年轻人,18-25岁，男女罹患率基本相等。","成人still病(亚败血症,变应性亚败血症)"
口腔痛|咽炎、舌炎、龈炎|溃疡|消瘦,全身,风湿科,"    白塞病(Behcet’s disease, BD)是一种全身性,慢性、血管炎症性疾病，主要临床表现为复发性口腔溃疡,生殖器溃疡、眼炎及皮肤损害，也可累及血管,神经系统、消化道、关节,肺、肾、附睾等器官,大部分患者预后良好，眼、中枢神经及大血管受累者预后不佳","白塞病(白塞,Behctet)"
脑膜刺激征|不自主运动|共济失调|步态异常|感觉障碍|其他症状,,"神经内科,风湿科","    风湿性舞蹈病又称小舞蹈病或Sydenham舞蹈病,是与风湿密切相关的、临床以不规则舞蹈样不自主动作和肌张力降低为主要表现的一种弥散性脑病。","风湿性舞蹈病(小舞蹈病,Sydenham舞蹈病)"
关节疼痛,全身,风湿科,"    类风湿性关节炎(rheumatoid arthritis)是一种以关节滑膜炎为特征的慢性全身性自身免疫性自身免疫性疾病,滑膜炎持久反复发作，可导致关节内软骨和骨的破坏，关节功能障碍,甚至残废。血管炎病变累及全身各个器官，故本病又称为类风湿病","类风湿性关节炎(类风湿,类风湿病)"
结节|身痛,全身,风湿科,"本病又名Rothmann-Makai综合征,1984年首次报告，1928年Makai命名本病为皮下脂质肉芽肿病。本病罕见,主要发生于儿童。有认为其是结节性脂膜炎的一型。结节散在,消退后无萎缩和凹陷，无全身症状。",皮下脂质肉芽肿病(Rothmann-Makai综合征)
尿频伴尿急和尿痛|少尿|血尿|脓尿|关节疼痛,全身,"内科,消化内科","    痢疾后综合症(Postdysenteric Syndrome),也称Reiter综合征、肠病后类风湿( Postenteric Rhematoid)、眼尿道关节炎综合征(Oculourebroarticular Syndrome),临床上以结膜炎、尿道炎和关节为为特征。多发于儿童,以男性为多见。","痢疾后综合症(Reiter综合征,肠病后类风湿,眼尿道关节炎综合征)"
